<?xml version="1.0" encoding="UTF-8"?>
<generate xmlns="http://www.spirit.org/mapper-generate-1.0"
	xmlns:xsi="http://www.w3.org/2001/XMLSchema-instance"
	xsi:schemaLocation="http://www.spirit.org/mapper-generate-1.0
 https://raw.githubusercontent.com/dqqiu/mapper-generate/master/other/xsd/mapper-generate-1.0.xsd">
	<database>
		<driver>com.mysql.jdbc.Driver</driver>
		<url>jdbc:mysql://127.0.0.1:3306/dictionary</url>
		<user>root</user>
		<password>root</password>
	</database>
	<modules>
		<model targetPackage="org.spirit.together.dictionary.api.model" />
		<vo targetPackage="org.spirit.together.dictionary.api.vo" serializable="true" />
		<mapper targetPackage="org.spirit.together.dictionary.api.mapper" />
		<xml targetPackage="org.spirit.together.dictionary.api.xml" />
		<service targetPackage="org.spirit.together.dictionary.api.service" />
		<controller targetPackage="org.spirit.together.dictionary.rest.controller" /> 
		<!--
		-->
	</modules>
	<tables>
		<table tableName="dict_state" primaryKey="cd"/>
		<table tableName="dict_province"  primaryKey="cd" />
		<table tableName="dict_city" primaryKey="cd"/>
		<table tableName="dict_district"  primaryKey="cd" />
		<table tableName="dict_data" primaryKey="cd"/>
		<table tableName="dict_type"  primaryKey="cd" />
		
	</tables>
	<output>D:/generate/code</output>
</generate>